
*** Running vivado
    with args -log design_1_wrapper.vdi -applog -m64 -product Vivado -messageDb vivado.pb -mode batch -source design_1_wrapper.tcl -notrace



****** Vivado v2023.2 (64-bit)
  **** SW Build 4029153 on Fri Oct 13 20:14:34 MDT 2023
  **** IP Build 4028589 on Sat Oct 14 00:45:43 MDT 2023
  **** SharedData Build 4025554 on Tue Oct 10 17:18:54 MDT 2023
    ** Copyright 1986-2022 Xilinx, Inc. All Rights Reserved.
    ** Copyright 2022-2023 Advanced Micro Devices, Inc. All Rights Reserved.

source design_1_wrapper.tcl -notrace
create_project: Time (s): cpu = 00:00:06 ; elapsed = 00:00:05 . Memory (MB): peak = 583.812 ; gain = 182.000
INFO: [IP_Flow 19-234] Refreshing IP repositories
INFO: [IP_Flow 19-1700] Loaded user IP repository 'd:/LVTN/lc3'.
WARNING: [IP_Flow 19-3656] If you move the project, the path for repository 'd:/LVTN/lc3' may become invalid. A better location for the repository would be in a path adjacent to the project. (Current project location is 'd:/LVTN/lc3_24/lc3_24.runs/impl_1'.)
INFO: [IP_Flow 19-2313] Loaded Vivado IP repository 'F:/Vivado/2023.2/data/ip'.
Command: link_design -top design_1_wrapper -part xc7z020clg400-1
Design is defaulting to srcset: sources_1
Design is defaulting to constrset: constrs_1
INFO: [Device 21-403] Loading part xc7z020clg400-1
INFO: [Project 1-454] Reading design checkpoint 'd:/LVTN/lc3_24/lc3_24.gen/sources_1/bd/design_1/ip/design_1_lc3_0_0/design_1_lc3_0_0.dcp' for cell 'design_1_i/lc3_0'
INFO: [Project 1-454] Reading design checkpoint 'd:/LVTN/lc3_24/lc3_24.gen/sources_1/bd/design_1/ip/design_1_processing_system7_0_0/design_1_processing_system7_0_0.dcp' for cell 'design_1_i/processing_system7_0'
INFO: [Project 1-454] Reading design checkpoint 'd:/LVTN/lc3_24/lc3_24.gen/sources_1/bd/design_1/ip/design_1_rst_ps7_0_50M_0/design_1_rst_ps7_0_50M_0.dcp' for cell 'design_1_i/rst_ps7_0_50M'
INFO: [Project 1-454] Reading design checkpoint 'd:/LVTN/lc3_24/lc3_24.gen/sources_1/bd/design_1/ip/design_1_auto_pc_0/design_1_auto_pc_0.dcp' for cell 'design_1_i/ps7_0_axi_periph/s00_couplers/auto_pc'
Netlist sorting complete. Time (s): cpu = 00:00:00 ; elapsed = 00:00:00.033 . Memory (MB): peak = 1041.578 ; gain = 0.000
INFO: [Netlist 29-17] Analyzing 105 Unisim elements for replacement
INFO: [Netlist 29-28] Unisim Transformation completed in 0 CPU seconds
INFO: [Project 1-479] Netlist was created with Vivado 2023.2
INFO: [Project 1-570] Preparing netlist for logic optimization
Parsing XDC File [d:/LVTN/lc3_24/lc3_24.gen/sources_1/bd/design_1/ip/design_1_processing_system7_0_0/design_1_processing_system7_0_0.xdc] for cell 'design_1_i/processing_system7_0/inst'
Finished Parsing XDC File [d:/LVTN/lc3_24/lc3_24.gen/sources_1/bd/design_1/ip/design_1_processing_system7_0_0/design_1_processing_system7_0_0.xdc] for cell 'design_1_i/processing_system7_0/inst'
Parsing XDC File [d:/LVTN/lc3_24/lc3_24.gen/sources_1/bd/design_1/ip/design_1_rst_ps7_0_50M_0/design_1_rst_ps7_0_50M_0_board.xdc] for cell 'design_1_i/rst_ps7_0_50M/U0'
Finished Parsing XDC File [d:/LVTN/lc3_24/lc3_24.gen/sources_1/bd/design_1/ip/design_1_rst_ps7_0_50M_0/design_1_rst_ps7_0_50M_0_board.xdc] for cell 'design_1_i/rst_ps7_0_50M/U0'
Parsing XDC File [d:/LVTN/lc3_24/lc3_24.gen/sources_1/bd/design_1/ip/design_1_rst_ps7_0_50M_0/design_1_rst_ps7_0_50M_0.xdc] for cell 'design_1_i/rst_ps7_0_50M/U0'
Finished Parsing XDC File [d:/LVTN/lc3_24/lc3_24.gen/sources_1/bd/design_1/ip/design_1_rst_ps7_0_50M_0/design_1_rst_ps7_0_50M_0.xdc] for cell 'design_1_i/rst_ps7_0_50M/U0'
INFO: [Opt 31-138] Pushed 0 inverter(s) to 0 load pin(s).
Netlist sorting complete. Time (s): cpu = 00:00:00 ; elapsed = 00:00:00.001 . Memory (MB): peak = 1191.410 ; gain = 0.000
INFO: [Project 1-111] Unisim Transformation Summary:
No Unisim elements were transformed.

The system cannot find the path specified.
14 Infos, 1 Warnings, 0 Critical Warnings and 0 Errors encountered.
link_design completed successfully
link_design: Time (s): cpu = 00:00:05 ; elapsed = 00:00:08 . Memory (MB): peak = 1191.410 ; gain = 587.305
Command: opt_design
Attempting to get a license for feature 'Implementation' and/or device 'xc7z020'
INFO: [Common 17-349] Got license for feature 'Implementation' and/or device 'xc7z020'
Running DRC as a precondition to command opt_design

Starting DRC Task
INFO: [DRC 23-27] Running DRC with 2 threads
INFO: [Project 1-461] DRC finished with 0 Errors
INFO: [Project 1-462] Please refer to the DRC report (report_drc) for more information.

Time (s): cpu = 00:00:02 ; elapsed = 00:00:02 . Memory (MB): peak = 1218.754 ; gain = 27.344

Starting Cache Timing Information Task
INFO: [Timing 38-35] Done setting XDC timing constraints.
Ending Cache Timing Information Task | Checksum: 15d60a7fe

Time (s): cpu = 00:00:11 ; elapsed = 00:00:12 . Memory (MB): peak = 1757.836 ; gain = 539.082

Starting Logic Optimization Task

Phase 1 Initialization

Phase 1.1 Core Generation And Design Setup
Phase 1.1 Core Generation And Design Setup | Checksum: 15d60a7fe

Time (s): cpu = 00:00:00 ; elapsed = 00:00:00.007 . Memory (MB): peak = 2123.945 ; gain = 0.000

Phase 1.2 Setup Constraints And Sort Netlist
Phase 1.2 Setup Constraints And Sort Netlist | Checksum: 15d60a7fe

Time (s): cpu = 00:00:00 ; elapsed = 00:00:00.015 . Memory (MB): peak = 2123.945 ; gain = 0.000
Phase 1 Initialization | Checksum: 15d60a7fe

Time (s): cpu = 00:00:00 ; elapsed = 00:00:00.016 . Memory (MB): peak = 2123.945 ; gain = 0.000

Phase 2 Timer Update And Timing Data Collection

Phase 2.1 Timer Update
Phase 2.1 Timer Update | Checksum: 15d60a7fe

Time (s): cpu = 00:00:00 ; elapsed = 00:00:00.129 . Memory (MB): peak = 2123.945 ; gain = 0.000

Phase 2.2 Timing Data Collection
Phase 2.2 Timing Data Collection | Checksum: 15d60a7fe

Time (s): cpu = 00:00:00 ; elapsed = 00:00:00.144 . Memory (MB): peak = 2123.945 ; gain = 0.000
Phase 2 Timer Update And Timing Data Collection | Checksum: 15d60a7fe

Time (s): cpu = 00:00:00 ; elapsed = 00:00:00.147 . Memory (MB): peak = 2123.945 ; gain = 0.000

Phase 3 Retarget
INFO: [Opt 31-138] Pushed 0 inverter(s) to 0 load pin(s).
INFO: [Opt 31-49] Retargeted 0 cell(s).
Phase 3 Retarget | Checksum: e1661611

Time (s): cpu = 00:00:00 ; elapsed = 00:00:00.270 . Memory (MB): peak = 2123.945 ; gain = 0.000
Retarget | Checksum: e1661611
INFO: [Opt 31-389] Phase Retarget created 4 cells and removed 29 cells

Phase 4 Constant propagation
INFO: [Opt 31-138] Pushed 0 inverter(s) to 0 load pin(s).
Phase 4 Constant propagation | Checksum: 18642fada

Time (s): cpu = 00:00:00 ; elapsed = 00:00:00.334 . Memory (MB): peak = 2123.945 ; gain = 0.000
Constant propagation | Checksum: 18642fada
INFO: [Opt 31-389] Phase Constant propagation created 0 cells and removed 72 cells

Phase 5 Sweep
Phase 5 Sweep | Checksum: c8040ad5

Time (s): cpu = 00:00:01 ; elapsed = 00:00:00.603 . Memory (MB): peak = 2123.945 ; gain = 0.000
Sweep | Checksum: c8040ad5
INFO: [Opt 31-389] Phase Sweep created 0 cells and removed 155 cells

Phase 6 BUFG optimization
Phase 6 BUFG optimization | Checksum: c8040ad5

Time (s): cpu = 00:00:01 ; elapsed = 00:00:00.685 . Memory (MB): peak = 2123.945 ; gain = 0.000
BUFG optimization | Checksum: c8040ad5
INFO: [Opt 31-662] Phase BUFG optimization created 0 cells of which 0 are BUFGs and removed 0 cells.

Phase 7 Shift Register Optimization
WARNING: [Opt 31-1131] Can not pull register out from design_1_i/ps7_0_axi_periph/s00_couplers/auto_pc/inst/gen_axilite.gen_b2s_conv.axilite_b2s/RD.r_channel_0/rd_data_fifo_0/memory_reg[31][0]_srl32 due to none static srl address bits
WARNING: [Opt 31-1131] Can not pull register out from design_1_i/ps7_0_axi_periph/s00_couplers/auto_pc/inst/gen_axilite.gen_b2s_conv.axilite_b2s/RD.r_channel_0/rd_data_fifo_0/memory_reg[31][10]_srl32 due to none static srl address bits
WARNING: [Opt 31-1131] Can not pull register out from design_1_i/ps7_0_axi_periph/s00_couplers/auto_pc/inst/gen_axilite.gen_b2s_conv.axilite_b2s/RD.r_channel_0/rd_data_fifo_0/memory_reg[31][11]_srl32 due to none static srl address bits
WARNING: [Opt 31-1131] Can not pull register out from design_1_i/ps7_0_axi_periph/s00_couplers/auto_pc/inst/gen_axilite.gen_b2s_conv.axilite_b2s/RD.r_channel_0/rd_data_fifo_0/memory_reg[31][12]_srl32 due to none static srl address bits
WARNING: [Opt 31-1131] Can not pull register out from design_1_i/ps7_0_axi_periph/s00_couplers/auto_pc/inst/gen_axilite.gen_b2s_conv.axilite_b2s/RD.r_channel_0/rd_data_fifo_0/memory_reg[31][13]_srl32 due to none static srl address bits
WARNING: [Opt 31-1131] Can not pull register out from design_1_i/ps7_0_axi_periph/s00_couplers/auto_pc/inst/gen_axilite.gen_b2s_conv.axilite_b2s/RD.r_channel_0/rd_data_fifo_0/memory_reg[31][14]_srl32 due to none static srl address bits
WARNING: [Opt 31-1131] Can not pull register out from design_1_i/ps7_0_axi_periph/s00_couplers/auto_pc/inst/gen_axilite.gen_b2s_conv.axilite_b2s/RD.r_channel_0/rd_data_fifo_0/memory_reg[31][15]_srl32 due to none static srl address bits
WARNING: [Opt 31-1131] Can not pull register out from design_1_i/ps7_0_axi_periph/s00_couplers/auto_pc/inst/gen_axilite.gen_b2s_conv.axilite_b2s/RD.r_channel_0/rd_data_fifo_0/memory_reg[31][7]_srl32 due to none static srl address bits
WARNING: [Opt 31-1131] Can not pull register out from design_1_i/ps7_0_axi_periph/s00_couplers/auto_pc/inst/gen_axilite.gen_b2s_conv.axilite_b2s/RD.r_channel_0/rd_data_fifo_0/memory_reg[31][8]_srl32 due to none static srl address bits
WARNING: [Opt 31-1131] Can not pull register out from design_1_i/ps7_0_axi_periph/s00_couplers/auto_pc/inst/gen_axilite.gen_b2s_conv.axilite_b2s/RD.r_channel_0/rd_data_fifo_0/memory_reg[31][9]_srl32 due to none static srl address bits
WARNING: [Opt 31-1131] Can not pull register out from design_1_i/ps7_0_axi_periph/s00_couplers/auto_pc/inst/gen_axilite.gen_b2s_conv.axilite_b2s/RD.r_channel_0/rd_data_fifo_0/memory_reg[31][3]_srl32 due to none static srl address bits
WARNING: [Opt 31-1131] Can not pull register out from design_1_i/ps7_0_axi_periph/s00_couplers/auto_pc/inst/gen_axilite.gen_b2s_conv.axilite_b2s/RD.r_channel_0/rd_data_fifo_0/memory_reg[31][1]_srl32 due to none static srl address bits
WARNING: [Opt 31-1131] Can not pull register out from design_1_i/ps7_0_axi_periph/s00_couplers/auto_pc/inst/gen_axilite.gen_b2s_conv.axilite_b2s/RD.r_channel_0/rd_data_fifo_0/memory_reg[31][4]_srl32 due to none static srl address bits
WARNING: [Opt 31-1131] Can not pull register out from design_1_i/ps7_0_axi_periph/s00_couplers/auto_pc/inst/gen_axilite.gen_b2s_conv.axilite_b2s/RD.r_channel_0/rd_data_fifo_0/memory_reg[31][5]_srl32 due to none static srl address bits
WARNING: [Opt 31-1131] Can not pull register out from design_1_i/ps7_0_axi_periph/s00_couplers/auto_pc/inst/gen_axilite.gen_b2s_conv.axilite_b2s/RD.r_channel_0/rd_data_fifo_0/memory_reg[31][2]_srl32 due to none static srl address bits
WARNING: [Opt 31-1131] Can not pull register out from design_1_i/ps7_0_axi_periph/s00_couplers/auto_pc/inst/gen_axilite.gen_b2s_conv.axilite_b2s/RD.r_channel_0/rd_data_fifo_0/memory_reg[31][6]_srl32 due to none static srl address bits
WARNING: [Opt 31-1131] Can not pull register out from design_1_i/ps7_0_axi_periph/s00_couplers/auto_pc/inst/gen_axilite.gen_b2s_conv.axilite_b2s/RD.r_channel_0/transaction_fifo_0/memory_reg[31][0]_srl32 due to none static srl address bits
WARNING: [Opt 31-1131] Can not pull register out from design_1_i/ps7_0_axi_periph/s00_couplers/auto_pc/inst/gen_axilite.gen_b2s_conv.axilite_b2s/RD.r_channel_0/transaction_fifo_0/memory_reg[31][10]_srl32 due to none static srl address bits
WARNING: [Opt 31-1131] Can not pull register out from design_1_i/ps7_0_axi_periph/s00_couplers/auto_pc/inst/gen_axilite.gen_b2s_conv.axilite_b2s/RD.r_channel_0/transaction_fifo_0/memory_reg[31][11]_srl32 due to none static srl address bits
WARNING: [Opt 31-1131] Can not pull register out from design_1_i/ps7_0_axi_periph/s00_couplers/auto_pc/inst/gen_axilite.gen_b2s_conv.axilite_b2s/RD.r_channel_0/transaction_fifo_0/memory_reg[31][12]_srl32 due to none static srl address bits
WARNING: [Opt 31-1131] Can not pull register out from design_1_i/ps7_0_axi_periph/s00_couplers/auto_pc/inst/gen_axilite.gen_b2s_conv.axilite_b2s/RD.r_channel_0/transaction_fifo_0/memory_reg[31][1]_srl32 due to none static srl address bits
WARNING: [Opt 31-1131] Can not pull register out from design_1_i/ps7_0_axi_periph/s00_couplers/auto_pc/inst/gen_axilite.gen_b2s_conv.axilite_b2s/RD.r_channel_0/transaction_fifo_0/memory_reg[31][2]_srl32 due to none static srl address bits
WARNING: [Opt 31-1131] Can not pull register out from design_1_i/ps7_0_axi_periph/s00_couplers/auto_pc/inst/gen_axilite.gen_b2s_conv.axilite_b2s/RD.r_channel_0/transaction_fifo_0/memory_reg[31][3]_srl32 due to none static srl address bits
WARNING: [Opt 31-1131] Can not pull register out from design_1_i/ps7_0_axi_periph/s00_couplers/auto_pc/inst/gen_axilite.gen_b2s_conv.axilite_b2s/RD.r_channel_0/transaction_fifo_0/memory_reg[31][4]_srl32 due to none static srl address bits
WARNING: [Opt 31-1131] Can not pull register out from design_1_i/ps7_0_axi_periph/s00_couplers/auto_pc/inst/gen_axilite.gen_b2s_conv.axilite_b2s/RD.r_channel_0/transaction_fifo_0/memory_reg[31][5]_srl32 due to none static srl address bits
WARNING: [Opt 31-1131] Can not pull register out from design_1_i/ps7_0_axi_periph/s00_couplers/auto_pc/inst/gen_axilite.gen_b2s_conv.axilite_b2s/RD.r_channel_0/transaction_fifo_0/memory_reg[31][6]_srl32 due to none static srl address bits
WARNING: [Opt 31-1131] Can not pull register out from design_1_i/ps7_0_axi_periph/s00_couplers/auto_pc/inst/gen_axilite.gen_b2s_conv.axilite_b2s/RD.r_channel_0/transaction_fifo_0/memory_reg[31][7]_srl32 due to none static srl address bits
WARNING: [Opt 31-1131] Can not pull register out from design_1_i/ps7_0_axi_periph/s00_couplers/auto_pc/inst/gen_axilite.gen_b2s_conv.axilite_b2s/RD.r_channel_0/transaction_fifo_0/memory_reg[31][8]_srl32 due to none static srl address bits
WARNING: [Opt 31-1131] Can not pull register out from design_1_i/ps7_0_axi_periph/s00_couplers/auto_pc/inst/gen_axilite.gen_b2s_conv.axilite_b2s/RD.r_channel_0/transaction_fifo_0/memory_reg[31][9]_srl32 due to none static srl address bits
WARNING: [Opt 31-1131] Can not pull register out from design_1_i/ps7_0_axi_periph/s00_couplers/auto_pc/inst/gen_axilite.gen_b2s_conv.axilite_b2s/WR.b_channel_0/bid_fifo_0/memory_reg[3][0]_srl4 due to none static srl address bits
WARNING: [Opt 31-1131] Can not pull register out from design_1_i/ps7_0_axi_periph/s00_couplers/auto_pc/inst/gen_axilite.gen_b2s_conv.axilite_b2s/WR.b_channel_0/bid_fifo_0/memory_reg[3][10]_srl4 due to none static srl address bits
WARNING: [Opt 31-1131] Can not pull register out from design_1_i/ps7_0_axi_periph/s00_couplers/auto_pc/inst/gen_axilite.gen_b2s_conv.axilite_b2s/WR.b_channel_0/bid_fifo_0/memory_reg[3][11]_srl4 due to none static srl address bits
WARNING: [Opt 31-1131] Can not pull register out from design_1_i/ps7_0_axi_periph/s00_couplers/auto_pc/inst/gen_axilite.gen_b2s_conv.axilite_b2s/WR.b_channel_0/bid_fifo_0/memory_reg[3][12]_srl4 due to none static srl address bits
WARNING: [Opt 31-1131] Can not pull register out from design_1_i/ps7_0_axi_periph/s00_couplers/auto_pc/inst/gen_axilite.gen_b2s_conv.axilite_b2s/WR.b_channel_0/bid_fifo_0/memory_reg[3][13]_srl4 due to none static srl address bits
WARNING: [Opt 31-1131] Can not pull register out from design_1_i/ps7_0_axi_periph/s00_couplers/auto_pc/inst/gen_axilite.gen_b2s_conv.axilite_b2s/WR.b_channel_0/bid_fifo_0/memory_reg[3][14]_srl4 due to none static srl address bits
WARNING: [Opt 31-1131] Can not pull register out from design_1_i/ps7_0_axi_periph/s00_couplers/auto_pc/inst/gen_axilite.gen_b2s_conv.axilite_b2s/WR.b_channel_0/bid_fifo_0/memory_reg[3][15]_srl4 due to none static srl address bits
WARNING: [Opt 31-1131] Can not pull register out from design_1_i/ps7_0_axi_periph/s00_couplers/auto_pc/inst/gen_axilite.gen_b2s_conv.axilite_b2s/WR.b_channel_0/bid_fifo_0/memory_reg[3][16]_srl4 due to none static srl address bits
WARNING: [Opt 31-1131] Can not pull register out from design_1_i/ps7_0_axi_periph/s00_couplers/auto_pc/inst/gen_axilite.gen_b2s_conv.axilite_b2s/WR.b_channel_0/bid_fifo_0/memory_reg[3][17]_srl4 due to none static srl address bits
WARNING: [Opt 31-1131] Can not pull register out from design_1_i/ps7_0_axi_periph/s00_couplers/auto_pc/inst/gen_axilite.gen_b2s_conv.axilite_b2s/WR.b_channel_0/bid_fifo_0/memory_reg[3][18]_srl4 due to none static srl address bits
WARNING: [Opt 31-1131] Can not pull register out from design_1_i/ps7_0_axi_periph/s00_couplers/auto_pc/inst/gen_axilite.gen_b2s_conv.axilite_b2s/WR.b_channel_0/bid_fifo_0/memory_reg[3][19]_srl4 due to none static srl address bits
WARNING: [Opt 31-1131] Can not pull register out from design_1_i/ps7_0_axi_periph/s00_couplers/auto_pc/inst/gen_axilite.gen_b2s_conv.axilite_b2s/WR.b_channel_0/bid_fifo_0/memory_reg[3][1]_srl4 due to none static srl address bits
WARNING: [Opt 31-1131] Can not pull register out from design_1_i/ps7_0_axi_periph/s00_couplers/auto_pc/inst/gen_axilite.gen_b2s_conv.axilite_b2s/WR.b_channel_0/bid_fifo_0/memory_reg[3][2]_srl4 due to none static srl address bits
WARNING: [Opt 31-1131] Can not pull register out from design_1_i/ps7_0_axi_periph/s00_couplers/auto_pc/inst/gen_axilite.gen_b2s_conv.axilite_b2s/WR.b_channel_0/bid_fifo_0/memory_reg[3][3]_srl4 due to none static srl address bits
WARNING: [Opt 31-1131] Can not pull register out from design_1_i/ps7_0_axi_periph/s00_couplers/auto_pc/inst/gen_axilite.gen_b2s_conv.axilite_b2s/WR.b_channel_0/bid_fifo_0/memory_reg[3][8]_srl4 due to none static srl address bits
WARNING: [Opt 31-1131] Can not pull register out from design_1_i/ps7_0_axi_periph/s00_couplers/auto_pc/inst/gen_axilite.gen_b2s_conv.axilite_b2s/WR.b_channel_0/bid_fifo_0/memory_reg[3][9]_srl4 due to none static srl address bits
WARNING: [Opt 31-1131] Can not pull register out from design_1_i/ps7_0_axi_periph/s00_couplers/auto_pc/inst/gen_axilite.gen_b2s_conv.axilite_b2s/WR.b_channel_0/bresp_fifo_0/memory_reg[3][0]_srl4 due to none static srl address bits
WARNING: [Opt 31-1131] Can not pull register out from design_1_i/ps7_0_axi_periph/s00_couplers/auto_pc/inst/gen_axilite.gen_b2s_conv.axilite_b2s/WR.b_channel_0/bresp_fifo_0/memory_reg[3][1]_srl4 due to none static srl address bits
INFO: [Opt 31-1064] SRL Remap converted 0 SRLs to 0 registers and converted 0 registers of register chains to 0 SRLs
Phase 7 Shift Register Optimization | Checksum: c8040ad5

Time (s): cpu = 00:00:01 ; elapsed = 00:00:00.699 . Memory (MB): peak = 2123.945 ; gain = 0.000
Shift Register Optimization | Checksum: c8040ad5
INFO: [Opt 31-389] Phase Shift Register Optimization created 0 cells and removed 0 cells

Phase 8 Post Processing Netlist
Phase 8 Post Processing Netlist | Checksum: c548b0e2

Time (s): cpu = 00:00:01 ; elapsed = 00:00:00.719 . Memory (MB): peak = 2123.945 ; gain = 0.000
Post Processing Netlist | Checksum: c548b0e2
INFO: [Opt 31-389] Phase Post Processing Netlist created 0 cells and removed 0 cells

Phase 9 Finalization

Phase 9.1 Finalizing Design Cores and Updating Shapes
Phase 9.1 Finalizing Design Cores and Updating Shapes | Checksum: 1de8f0154

Time (s): cpu = 00:00:01 ; elapsed = 00:00:00.840 . Memory (MB): peak = 2123.945 ; gain = 0.000

Phase 9.2 Verifying Netlist Connectivity

Starting Connectivity Check Task

Time (s): cpu = 00:00:00 ; elapsed = 00:00:00.010 . Memory (MB): peak = 2123.945 ; gain = 0.000
Phase 9.2 Verifying Netlist Connectivity | Checksum: 1de8f0154

Time (s): cpu = 00:00:01 ; elapsed = 00:00:00.853 . Memory (MB): peak = 2123.945 ; gain = 0.000
Phase 9 Finalization | Checksum: 1de8f0154

Time (s): cpu = 00:00:01 ; elapsed = 00:00:00.856 . Memory (MB): peak = 2123.945 ; gain = 0.000
Opt_design Change Summary
=========================


-------------------------------------------------------------------------------------------------------------------------
|  Phase                        |  #Cells created  |  #Cells Removed  |  #Constrained objects preventing optimizations  |
-------------------------------------------------------------------------------------------------------------------------
|  Retarget                     |               4  |              29  |                                              0  |
|  Constant propagation         |               0  |              72  |                                              0  |
|  Sweep                        |               0  |             155  |                                              0  |
|  BUFG optimization            |               0  |               0  |                                              0  |
|  Shift Register Optimization  |               0  |               0  |                                              0  |
|  Post Processing Netlist      |               0  |               0  |                                              0  |
-------------------------------------------------------------------------------------------------------------------------


Ending Logic Optimization Task | Checksum: 1de8f0154

Time (s): cpu = 00:00:01 ; elapsed = 00:00:00.860 . Memory (MB): peak = 2123.945 ; gain = 0.000
INFO: [Constraints 18-11670] Building netlist checker database with flags, 0x8
Done building netlist checker database: Time (s): cpu = 00:00:00 ; elapsed = 00:00:00.002 . Memory (MB): peak = 2123.945 ; gain = 0.000

Starting Power Optimization Task
INFO: [Pwropt 34-132] Skipping clock gating for clocks with a period < 2.00 ns.
INFO: [Timing 38-35] Done setting XDC timing constraints.
Running Vector-less Activity Propagation...

Finished Running Vector-less Activity Propagation
INFO: [Pwropt 34-9] Applying IDT optimizations ...
INFO: [Pwropt 34-10] Applying ODC optimizations ...


Starting PowerOpt Patch Enables Task
INFO: [Pwropt 34-162] WRITE_MODE attribute of 0 BRAM(s) out of a total of 33 has been updated to save power. Run report_power_opt to get a complete listing of the BRAMs updated.
INFO: [Pwropt 34-201] Structural ODC has moved 0 WE to EN ports
Number of BRAM Ports augmented: 0 newly gated: 0 Total Ports: 66
Ending PowerOpt Patch Enables Task | Checksum: 1de8f0154

Time (s): cpu = 00:00:00 ; elapsed = 00:00:00.157 . Memory (MB): peak = 2212.082 ; gain = 0.000
Ending Power Optimization Task | Checksum: 1de8f0154

Time (s): cpu = 00:00:05 ; elapsed = 00:00:04 . Memory (MB): peak = 2212.082 ; gain = 88.137

Starting Final Cleanup Task
Ending Final Cleanup Task | Checksum: 1de8f0154

Time (s): cpu = 00:00:00 ; elapsed = 00:00:00.002 . Memory (MB): peak = 2212.082 ; gain = 0.000

Starting Netlist Obfuscation Task
Netlist sorting complete. Time (s): cpu = 00:00:00 ; elapsed = 00:00:00.001 . Memory (MB): peak = 2212.082 ; gain = 0.000
Ending Netlist Obfuscation Task | Checksum: 1de8f0154

Time (s): cpu = 00:00:00 ; elapsed = 00:00:00.003 . Memory (MB): peak = 2212.082 ; gain = 0.000
INFO: [Common 17-83] Releasing license: Implementation
37 Infos, 48 Warnings, 0 Critical Warnings and 0 Errors encountered.
opt_design completed successfully
opt_design: Time (s): cpu = 00:00:24 ; elapsed = 00:00:24 . Memory (MB): peak = 2212.082 ; gain = 1020.672
INFO: [runtcl-4] Executing : report_drc -file design_1_wrapper_drc_opted.rpt -pb design_1_wrapper_drc_opted.pb -rpx design_1_wrapper_drc_opted.rpx
Command: report_drc -file design_1_wrapper_drc_opted.rpt -pb design_1_wrapper_drc_opted.pb -rpx design_1_wrapper_drc_opted.rpx
INFO: [IP_Flow 19-1839] IP Catalog is up to date.
INFO: [DRC 23-27] Running DRC with 2 threads
INFO: [Vivado_Tcl 2-168] The results of DRC are in file D:/LVTN/lc3_24/lc3_24.runs/impl_1/design_1_wrapper_drc_opted.rpt.
report_drc completed successfully
INFO: [Timing 38-480] Writing timing data to binary archive.
Write ShapeDB Complete: Time (s): cpu = 00:00:00 ; elapsed = 00:00:00.018 . Memory (MB): peak = 2212.082 ; gain = 0.000
Wrote PlaceDB: Time (s): cpu = 00:00:00 ; elapsed = 00:00:00.028 . Memory (MB): peak = 2212.082 ; gain = 0.000
Wrote PulsedLatchDB: Time (s): cpu = 00:00:00 ; elapsed = 00:00:00.001 . Memory (MB): peak = 2212.082 ; gain = 0.000
Writing XDEF routing.
Writing XDEF routing logical nets.
Writing XDEF routing special nets.
Wrote RouteStorage: Time (s): cpu = 00:00:00 ; elapsed = 00:00:00.042 . Memory (MB): peak = 2212.082 ; gain = 0.000
Wrote Netlist Cache: Time (s): cpu = 00:00:00 ; elapsed = 00:00:00.001 . Memory (MB): peak = 2212.082 ; gain = 0.000
Wrote Device Cache: Time (s): cpu = 00:00:00 ; elapsed = 00:00:00.019 . Memory (MB): peak = 2212.082 ; gain = 0.000
Write Physdb Complete: Time (s): cpu = 00:00:00 ; elapsed = 00:00:00.098 . Memory (MB): peak = 2212.082 ; gain = 0.000
INFO: [Common 17-1381] The checkpoint 'D:/LVTN/lc3_24/lc3_24.runs/impl_1/design_1_wrapper_opt.dcp' has been generated.
Command: place_design
Attempting to get a license for feature 'Implementation' and/or device 'xc7z020'
INFO: [Common 17-349] Got license for feature 'Implementation' and/or device 'xc7z020'
INFO: [Common 17-83] Releasing license: Implementation
INFO: [DRC 23-27] Running DRC with 2 threads
INFO: [Vivado_Tcl 4-198] DRC finished with 0 Errors
INFO: [Vivado_Tcl 4-199] Please refer to the DRC report (report_drc) for more information.
Running DRC as a precondition to command place_design
INFO: [DRC 23-27] Running DRC with 2 threads
INFO: [Vivado_Tcl 4-198] DRC finished with 0 Errors
INFO: [Vivado_Tcl 4-199] Please refer to the DRC report (report_drc) for more information.
INFO: [Place 30-611] Multithreading enabled for place_design using a maximum of 2 CPUs

Starting Placer Task

Phase 1 Placer Initialization

Phase 1.1 Placer Initialization Netlist Sorting
Netlist sorting complete. Time (s): cpu = 00:00:00 ; elapsed = 00:00:00.002 . Memory (MB): peak = 2212.082 ; gain = 0.000
Phase 1.1 Placer Initialization Netlist Sorting | Checksum: dfda40eb

Time (s): cpu = 00:00:00 ; elapsed = 00:00:00.013 . Memory (MB): peak = 2212.082 ; gain = 0.000
Netlist sorting complete. Time (s): cpu = 00:00:00 ; elapsed = 00:00:00.001 . Memory (MB): peak = 2212.082 ; gain = 0.000

Phase 1.2 IO Placement/ Clock Placement/ Build Placer Device
INFO: [Timing 38-35] Done setting XDC timing constraints.
Phase 1.2 IO Placement/ Clock Placement/ Build Placer Device | Checksum: f2eb4a9d

Time (s): cpu = 00:00:01 ; elapsed = 00:00:01 . Memory (MB): peak = 2212.082 ; gain = 0.000

Phase 1.3 Build Placer Netlist Model
Phase 1.3 Build Placer Netlist Model | Checksum: e2a76659

Time (s): cpu = 00:00:03 ; elapsed = 00:00:02 . Memory (MB): peak = 2212.082 ; gain = 0.000

Phase 1.4 Constrain Clocks/Macros
Phase 1.4 Constrain Clocks/Macros | Checksum: e2a76659

Time (s): cpu = 00:00:03 ; elapsed = 00:00:02 . Memory (MB): peak = 2212.082 ; gain = 0.000
Phase 1 Placer Initialization | Checksum: e2a76659

Time (s): cpu = 00:00:03 ; elapsed = 00:00:02 . Memory (MB): peak = 2212.082 ; gain = 0.000

Phase 2 Global Placement

Phase 2.1 Floorplanning
Phase 2.1 Floorplanning | Checksum: 14f37b48f

Time (s): cpu = 00:00:03 ; elapsed = 00:00:02 . Memory (MB): peak = 2212.082 ; gain = 0.000

Phase 2.2 Update Timing before SLR Path Opt
Phase 2.2 Update Timing before SLR Path Opt | Checksum: 1647908c8

Time (s): cpu = 00:00:04 ; elapsed = 00:00:03 . Memory (MB): peak = 2212.082 ; gain = 0.000

Phase 2.3 Post-Processing in Floorplanning
Phase 2.3 Post-Processing in Floorplanning | Checksum: 1647908c8

Time (s): cpu = 00:00:04 ; elapsed = 00:00:03 . Memory (MB): peak = 2212.082 ; gain = 0.000

Phase 2.4 Global Placement Core

Phase 2.4.1 UpdateTiming Before Physical Synthesis
Phase 2.4.1 UpdateTiming Before Physical Synthesis | Checksum: a744f999

Time (s): cpu = 00:00:08 ; elapsed = 00:00:07 . Memory (MB): peak = 2212.082 ; gain = 0.000

Phase 2.4.2 Physical Synthesis In Placer
INFO: [Physopt 32-1035] Found 0 LUTNM shape to break, 634 LUT instances to create LUTNM shape
INFO: [Physopt 32-1044] Break lutnm for timing: one critical 0, two critical 0, total 0, new lutff created 0
INFO: [Physopt 32-1138] End 1 Pass. Optimized 284 nets or LUTs. Breaked 0 LUT, combined 284 existing LUTs and moved 0 existing LUT
INFO: [Physopt 32-65] No nets found for high-fanout optimization.
INFO: [Physopt 32-232] Optimized 0 net. Created 0 new instance.
INFO: [Physopt 32-775] End 1 Pass. Optimized 0 net or cell. Created 0 new cell, deleted 0 existing cell and moved 0 existing cell
INFO: [Physopt 32-670] No setup violation found.  DSP Register Optimization was not performed.
INFO: [Physopt 32-670] No setup violation found.  Shift Register to Pipeline Optimization was not performed.
INFO: [Physopt 32-670] No setup violation found.  Shift Register Optimization was not performed.
INFO: [Physopt 32-670] No setup violation found.  BRAM Register Optimization was not performed.
INFO: [Physopt 32-670] No setup violation found.  URAM Register Optimization was not performed.
INFO: [Physopt 32-949] No candidate nets found for dynamic/static region interface net replication
INFO: [Physopt 32-775] End 1 Pass. Optimized 0 net or cell. Created 0 new cell, deleted 0 existing cell and moved 0 existing cell
Netlist sorting complete. Time (s): cpu = 00:00:00 ; elapsed = 00:00:00.001 . Memory (MB): peak = 2212.082 ; gain = 0.000

Summary of Physical Synthesis Optimizations
============================================


-----------------------------------------------------------------------------------------------------------------------------------------------------------
|  Optimization                                     |  Added Cells  |  Removed Cells  |  Optimized Cells/Nets  |  Dont Touch  |  Iterations  |  Elapsed   |
-----------------------------------------------------------------------------------------------------------------------------------------------------------
|  LUT Combining                                    |            0  |            284  |                   284  |           0  |           1  |  00:00:00  |
|  Retime                                           |            0  |              0  |                     0  |           0  |           1  |  00:00:00  |
|  Very High Fanout                                 |            0  |              0  |                     0  |           0  |           1  |  00:00:00  |
|  DSP Register                                     |            0  |              0  |                     0  |           0  |           0  |  00:00:00  |
|  Shift Register to Pipeline                       |            0  |              0  |                     0  |           0  |           0  |  00:00:00  |
|  Shift Register                                   |            0  |              0  |                     0  |           0  |           0  |  00:00:00  |
|  BRAM Register                                    |            0  |              0  |                     0  |           0  |           0  |  00:00:00  |
|  URAM Register                                    |            0  |              0  |                     0  |           0  |           0  |  00:00:00  |
|  Dynamic/Static Region Interface Net Replication  |            0  |              0  |                     0  |           0  |           1  |  00:00:00  |
|  Total                                            |            0  |            284  |                   284  |           0  |           4  |  00:00:00  |
-----------------------------------------------------------------------------------------------------------------------------------------------------------


Phase 2.4.2 Physical Synthesis In Placer | Checksum: 60d14dbf

Time (s): cpu = 00:00:09 ; elapsed = 00:00:08 . Memory (MB): peak = 2212.082 ; gain = 0.000
Phase 2.4 Global Placement Core | Checksum: 7c48870b

Time (s): cpu = 00:00:10 ; elapsed = 00:00:08 . Memory (MB): peak = 2212.082 ; gain = 0.000
Phase 2 Global Placement | Checksum: 7c48870b

Time (s): cpu = 00:00:10 ; elapsed = 00:00:08 . Memory (MB): peak = 2212.082 ; gain = 0.000

Phase 3 Detail Placement

Phase 3.1 Commit Multi Column Macros
Phase 3.1 Commit Multi Column Macros | Checksum: 8f614462

Time (s): cpu = 00:00:10 ; elapsed = 00:00:08 . Memory (MB): peak = 2212.082 ; gain = 0.000

Phase 3.2 Commit Most Macros & LUTRAMs
Phase 3.2 Commit Most Macros & LUTRAMs | Checksum: 1ce9eb1c0

Time (s): cpu = 00:00:11 ; elapsed = 00:00:09 . Memory (MB): peak = 2212.082 ; gain = 0.000

Phase 3.3 Area Swap Optimization
Phase 3.3 Area Swap Optimization | Checksum: 191b92a84

Time (s): cpu = 00:00:11 ; elapsed = 00:00:09 . Memory (MB): peak = 2212.082 ; gain = 0.000

Phase 3.4 Pipeline Register Optimization
Phase 3.4 Pipeline Register Optimization | Checksum: 1664ea74e

Time (s): cpu = 00:00:11 ; elapsed = 00:00:09 . Memory (MB): peak = 2212.082 ; gain = 0.000

Phase 3.5 Small Shape Detail Placement
Phase 3.5 Small Shape Detail Placement | Checksum: ed5cbb56

Time (s): cpu = 00:00:12 ; elapsed = 00:00:10 . Memory (MB): peak = 2212.082 ; gain = 0.000

Phase 3.6 Re-assign LUT pins
Phase 3.6 Re-assign LUT pins | Checksum: 13d7ea81c

Time (s): cpu = 00:00:12 ; elapsed = 00:00:10 . Memory (MB): peak = 2212.082 ; gain = 0.000

Phase 3.7 Pipeline Register Optimization
Phase 3.7 Pipeline Register Optimization | Checksum: 169e92442

Time (s): cpu = 00:00:12 ; elapsed = 00:00:10 . Memory (MB): peak = 2212.082 ; gain = 0.000
Phase 3 Detail Placement | Checksum: 169e92442

Time (s): cpu = 00:00:12 ; elapsed = 00:00:10 . Memory (MB): peak = 2212.082 ; gain = 0.000

Phase 4 Post Placement Optimization and Clean-Up

Phase 4.1 Post Commit Optimization
INFO: [Timing 38-35] Done setting XDC timing constraints.

Phase 4.1.1 Post Placement Optimization
Post Placement Optimization Initialization | Checksum: 12ec1b9a6

Phase 4.1.1.1 BUFG Insertion

Starting Physical Synthesis Task

Phase 1 Physical Synthesis Initialization
INFO: [Physopt 32-721] Multithreading enabled for phys_opt_design using a maximum of 2 CPUs
INFO: [Physopt 32-619] Estimated Timing Summary | WNS=9.719 | TNS=0.000 |
Phase 1 Physical Synthesis Initialization | Checksum: 1933c76a7

Time (s): cpu = 00:00:00 ; elapsed = 00:00:00.243 . Memory (MB): peak = 2212.082 ; gain = 0.000
INFO: [Place 46-56] BUFG insertion identified 0 candidate nets. Inserted BUFG: 0, Replicated BUFG Driver: 0, Skipped due to Placement/Routing Conflicts: 0, Skipped due to Timing Degradation: 0, Skipped due to netlist editing failed: 0.
Ending Physical Synthesis Task | Checksum: 1933c76a7

Time (s): cpu = 00:00:00 ; elapsed = 00:00:00.277 . Memory (MB): peak = 2212.082 ; gain = 0.000
Phase 4.1.1.1 BUFG Insertion | Checksum: 12ec1b9a6

Time (s): cpu = 00:00:15 ; elapsed = 00:00:12 . Memory (MB): peak = 2212.082 ; gain = 0.000

Phase 4.1.1.2 Post Placement Timing Optimization
INFO: [Place 30-746] Post Placement Timing Summary WNS=9.719. For the most accurate timing information please run report_timing.
Phase 4.1.1.2 Post Placement Timing Optimization | Checksum: 14158a11b

Time (s): cpu = 00:00:15 ; elapsed = 00:00:12 . Memory (MB): peak = 2212.082 ; gain = 0.000

Time (s): cpu = 00:00:15 ; elapsed = 00:00:12 . Memory (MB): peak = 2212.082 ; gain = 0.000
Phase 4.1 Post Commit Optimization | Checksum: 14158a11b

Time (s): cpu = 00:00:15 ; elapsed = 00:00:12 . Memory (MB): peak = 2212.082 ; gain = 0.000

Phase 4.2 Post Placement Cleanup
Phase 4.2 Post Placement Cleanup | Checksum: 14158a11b

Time (s): cpu = 00:00:15 ; elapsed = 00:00:12 . Memory (MB): peak = 2212.082 ; gain = 0.000

Phase 4.3 Placer Reporting

Phase 4.3.1 Print Estimated Congestion
INFO: [Place 30-612] Post-Placement Estimated Congestion 
 ____________________________________________________
|           | Global Congestion | Short Congestion  |
| Direction | Region Size       | Region Size       |
|___________|___________________|___________________|
|      North|                1x1|                1x1|
|___________|___________________|___________________|
|      South|                1x1|                1x1|
|___________|___________________|___________________|
|       East|                1x1|                1x1|
|___________|___________________|___________________|
|       West|                1x1|                1x1|
|___________|___________________|___________________|

Phase 4.3.1 Print Estimated Congestion | Checksum: 14158a11b

Time (s): cpu = 00:00:15 ; elapsed = 00:00:12 . Memory (MB): peak = 2212.082 ; gain = 0.000
Phase 4.3 Placer Reporting | Checksum: 14158a11b

Time (s): cpu = 00:00:15 ; elapsed = 00:00:12 . Memory (MB): peak = 2212.082 ; gain = 0.000

Phase 4.4 Final Placement Cleanup
Netlist sorting complete. Time (s): cpu = 00:00:00 ; elapsed = 00:00:00.001 . Memory (MB): peak = 2212.082 ; gain = 0.000

Time (s): cpu = 00:00:15 ; elapsed = 00:00:12 . Memory (MB): peak = 2212.082 ; gain = 0.000
Phase 4 Post Placement Optimization and Clean-Up | Checksum: 12af65d5f

Time (s): cpu = 00:00:15 ; elapsed = 00:00:12 . Memory (MB): peak = 2212.082 ; gain = 0.000
Ending Placer Task | Checksum: 7e257282

Time (s): cpu = 00:00:15 ; elapsed = 00:00:12 . Memory (MB): peak = 2212.082 ; gain = 0.000
72 Infos, 48 Warnings, 0 Critical Warnings and 0 Errors encountered.
place_design completed successfully
place_design: Time (s): cpu = 00:00:18 ; elapsed = 00:00:14 . Memory (MB): peak = 2212.082 ; gain = 0.000
INFO: [runtcl-4] Executing : report_io -file design_1_wrapper_io_placed.rpt
report_io: Time (s): cpu = 00:00:00 ; elapsed = 00:00:00.113 . Memory (MB): peak = 2212.082 ; gain = 0.000
INFO: [runtcl-4] Executing : report_utilization -file design_1_wrapper_utilization_placed.rpt -pb design_1_wrapper_utilization_placed.pb
INFO: [runtcl-4] Executing : report_control_sets -verbose -file design_1_wrapper_control_sets_placed.rpt
report_control_sets: Time (s): cpu = 00:00:00 ; elapsed = 00:00:00.009 . Memory (MB): peak = 2212.082 ; gain = 0.000
INFO: [Timing 38-480] Writing timing data to binary archive.
Write ShapeDB Complete: Time (s): cpu = 00:00:00 ; elapsed = 00:00:00.020 . Memory (MB): peak = 2212.082 ; gain = 0.000
Wrote PlaceDB: Time (s): cpu = 00:00:01 ; elapsed = 00:00:00.325 . Memory (MB): peak = 2212.082 ; gain = 0.000
Wrote PulsedLatchDB: Time (s): cpu = 00:00:00 ; elapsed = 00:00:00 . Memory (MB): peak = 2212.082 ; gain = 0.000
Writing XDEF routing.
Writing XDEF routing logical nets.
Writing XDEF routing special nets.
Wrote RouteStorage: Time (s): cpu = 00:00:00 ; elapsed = 00:00:00.039 . Memory (MB): peak = 2212.082 ; gain = 0.000
Wrote Netlist Cache: Time (s): cpu = 00:00:00 ; elapsed = 00:00:00.004 . Memory (MB): peak = 2212.082 ; gain = 0.000
Wrote Device Cache: Time (s): cpu = 00:00:00 ; elapsed = 00:00:00.016 . Memory (MB): peak = 2212.082 ; gain = 0.000
Write Physdb Complete: Time (s): cpu = 00:00:01 ; elapsed = 00:00:00.393 . Memory (MB): peak = 2212.082 ; gain = 0.000
INFO: [Common 17-1381] The checkpoint 'D:/LVTN/lc3_24/lc3_24.runs/impl_1/design_1_wrapper_placed.dcp' has been generated.
Command: phys_opt_design
Attempting to get a license for feature 'Implementation' and/or device 'xc7z020'
INFO: [Common 17-349] Got license for feature 'Implementation' and/or device 'xc7z020'

Starting Initial Update Timing Task

Time (s): cpu = 00:00:01 ; elapsed = 00:00:00.844 . Memory (MB): peak = 2212.082 ; gain = 0.000
INFO: [Vivado_Tcl 4-383] Design worst setup slack (WNS) is greater than or equal to 0.000 ns. Skipping all physical synthesis optimizations.
INFO: [Vivado_Tcl 4-232] No setup violation found. The netlist was not modified.
INFO: [Common 17-83] Releasing license: Implementation
81 Infos, 48 Warnings, 0 Critical Warnings and 0 Errors encountered.
phys_opt_design completed successfully
INFO: [Timing 38-480] Writing timing data to binary archive.
Write ShapeDB Complete: Time (s): cpu = 00:00:00 ; elapsed = 00:00:00.020 . Memory (MB): peak = 2212.082 ; gain = 0.000
Wrote PlaceDB: Time (s): cpu = 00:00:01 ; elapsed = 00:00:00.341 . Memory (MB): peak = 2212.082 ; gain = 0.000
Wrote PulsedLatchDB: Time (s): cpu = 00:00:00 ; elapsed = 00:00:00 . Memory (MB): peak = 2212.082 ; gain = 0.000
Writing XDEF routing.
Writing XDEF routing logical nets.
Writing XDEF routing special nets.
Wrote RouteStorage: Time (s): cpu = 00:00:00 ; elapsed = 00:00:00.036 . Memory (MB): peak = 2212.082 ; gain = 0.000
Wrote Netlist Cache: Time (s): cpu = 00:00:00 ; elapsed = 00:00:00.008 . Memory (MB): peak = 2212.082 ; gain = 0.000
Wrote Device Cache: Time (s): cpu = 00:00:00 ; elapsed = 00:00:00.020 . Memory (MB): peak = 2212.082 ; gain = 0.000
Write Physdb Complete: Time (s): cpu = 00:00:01 ; elapsed = 00:00:00.415 . Memory (MB): peak = 2212.082 ; gain = 0.000
INFO: [Common 17-1381] The checkpoint 'D:/LVTN/lc3_24/lc3_24.runs/impl_1/design_1_wrapper_physopt.dcp' has been generated.
Command: route_design
Attempting to get a license for feature 'Implementation' and/or device 'xc7z020'
INFO: [Common 17-349] Got license for feature 'Implementation' and/or device 'xc7z020'
Running DRC as a precondition to command route_design
INFO: [DRC 23-27] Running DRC with 2 threads
INFO: [Vivado_Tcl 4-198] DRC finished with 0 Errors
INFO: [Vivado_Tcl 4-199] Please refer to the DRC report (report_drc) for more information.


Starting Routing Task
INFO: [Route 35-254] Multithreading enabled for route_design using a maximum of 8 CPUs

Phase 1 Build RT Design
Checksum: PlaceDB: 601e1b1f ConstDB: 0 ShapeSum: 1e075763 RouteDB: 0
Post Restoration Checksum: NetGraph: 248b23a2 | NumContArr: 4474ca7a | Constraints: c2a8fa9d | Timing: c2a8fa9d
Phase 1 Build RT Design | Checksum: 1ee51e356

Time (s): cpu = 00:00:43 ; elapsed = 00:00:40 . Memory (MB): peak = 2299.289 ; gain = 87.207

Phase 2 Router Initialization

Phase 2.1 Fix Topology Constraints
Phase 2.1 Fix Topology Constraints | Checksum: 1ee51e356

Time (s): cpu = 00:00:43 ; elapsed = 00:00:40 . Memory (MB): peak = 2299.289 ; gain = 87.207

Phase 2.2 Pre Route Cleanup
Phase 2.2 Pre Route Cleanup | Checksum: 1ee51e356

Time (s): cpu = 00:00:43 ; elapsed = 00:00:40 . Memory (MB): peak = 2299.289 ; gain = 87.207
 Number of Nodes with overlaps = 0

Phase 2.3 Update Timing
Phase 2.3 Update Timing | Checksum: 26e573036

Time (s): cpu = 00:00:45 ; elapsed = 00:00:42 . Memory (MB): peak = 2367.703 ; gain = 155.621
INFO: [Route 35-416] Intermediate Timing Summary | WNS=9.711  | TNS=0.000  | WHS=-0.173 | THS=-16.625|


Router Utilization Summary
  Global Vertical Routing Utilization    = 0 %
  Global Horizontal Routing Utilization  = 0 %
  Routable Net Status*
  *Does not include unroutable nets such as driverless and loadless.
  Run report_route_status for detailed report.
  Number of Failed Nets               = 2868
    (Failed Nets is the sum of unrouted and partially routed nets)
  Number of Unrouted Nets             = 2868
  Number of Partially Routed Nets     = 0
  Number of Node Overlaps             = 0

Phase 2 Router Initialization | Checksum: 1e4af6b4b

Time (s): cpu = 00:00:46 ; elapsed = 00:00:43 . Memory (MB): peak = 2382.008 ; gain = 169.926

Phase 3 Initial Routing

Phase 3.1 Global Routing
Phase 3.1 Global Routing | Checksum: 1e4af6b4b

Time (s): cpu = 00:00:46 ; elapsed = 00:00:43 . Memory (MB): peak = 2382.008 ; gain = 169.926

Phase 3.2 Initial Net Routing
Phase 3.2 Initial Net Routing | Checksum: 2c7608b5d

Time (s): cpu = 00:00:50 ; elapsed = 00:00:44 . Memory (MB): peak = 2382.008 ; gain = 169.926
Phase 3 Initial Routing | Checksum: 2c7608b5d

Time (s): cpu = 00:00:50 ; elapsed = 00:00:44 . Memory (MB): peak = 2382.008 ; gain = 169.926

Phase 4 Rip-up And Reroute

Phase 4.1 Global Iteration 0
 Number of Nodes with overlaps = 159
 Number of Nodes with overlaps = 0
INFO: [Route 35-416] Intermediate Timing Summary | WNS=7.848  | TNS=0.000  | WHS=N/A    | THS=N/A    |

Phase 4.1 Global Iteration 0 | Checksum: 1e592bfeb

Time (s): cpu = 00:00:53 ; elapsed = 00:00:45 . Memory (MB): peak = 2382.008 ; gain = 169.926

Phase 4.2 Global Iteration 1
 Number of Nodes with overlaps = 2
 Number of Nodes with overlaps = 0
INFO: [Route 35-416] Intermediate Timing Summary | WNS=7.848  | TNS=0.000  | WHS=N/A    | THS=N/A    |

Phase 4.2 Global Iteration 1 | Checksum: 269e91bef

Time (s): cpu = 00:00:53 ; elapsed = 00:00:45 . Memory (MB): peak = 2382.008 ; gain = 169.926
Phase 4 Rip-up And Reroute | Checksum: 269e91bef

Time (s): cpu = 00:00:53 ; elapsed = 00:00:45 . Memory (MB): peak = 2382.008 ; gain = 169.926

Phase 5 Delay and Skew Optimization

Phase 5.1 Delay CleanUp

Phase 5.1.1 Update Timing
Phase 5.1.1 Update Timing | Checksum: 2c06b4faa

Time (s): cpu = 00:00:53 ; elapsed = 00:00:45 . Memory (MB): peak = 2382.008 ; gain = 169.926
INFO: [Route 35-416] Intermediate Timing Summary | WNS=7.963  | TNS=0.000  | WHS=N/A    | THS=N/A    |

Phase 5.1 Delay CleanUp | Checksum: 2c06b4faa

Time (s): cpu = 00:00:53 ; elapsed = 00:00:45 . Memory (MB): peak = 2382.008 ; gain = 169.926

Phase 5.2 Clock Skew Optimization
Phase 5.2 Clock Skew Optimization | Checksum: 2c06b4faa

Time (s): cpu = 00:00:53 ; elapsed = 00:00:45 . Memory (MB): peak = 2382.008 ; gain = 169.926
Phase 5 Delay and Skew Optimization | Checksum: 2c06b4faa

Time (s): cpu = 00:00:53 ; elapsed = 00:00:45 . Memory (MB): peak = 2382.008 ; gain = 169.926

Phase 6 Post Hold Fix

Phase 6.1 Hold Fix Iter

Phase 6.1.1 Update Timing
Phase 6.1.1 Update Timing | Checksum: 25cd96ae9

Time (s): cpu = 00:00:54 ; elapsed = 00:00:46 . Memory (MB): peak = 2382.008 ; gain = 169.926
INFO: [Route 35-416] Intermediate Timing Summary | WNS=7.963  | TNS=0.000  | WHS=0.077  | THS=0.000  |

Phase 6.1 Hold Fix Iter | Checksum: 21ea4510e

Time (s): cpu = 00:00:54 ; elapsed = 00:00:46 . Memory (MB): peak = 2382.008 ; gain = 169.926
Phase 6 Post Hold Fix | Checksum: 21ea4510e

Time (s): cpu = 00:00:54 ; elapsed = 00:00:46 . Memory (MB): peak = 2382.008 ; gain = 169.926

Phase 7 Route finalize

Router Utilization Summary
  Global Vertical Routing Utilization    = 0.820596 %
  Global Horizontal Routing Utilization  = 0.785074 %
  Routable Net Status*
  *Does not include unroutable nets such as driverless and loadless.
  Run report_route_status for detailed report.
  Number of Failed Nets               = 0
    (Failed Nets is the sum of unrouted and partially routed nets)
  Number of Unrouted Nets             = 0
  Number of Partially Routed Nets     = 0
  Number of Node Overlaps             = 0

Phase 7 Route finalize | Checksum: 21ea4510e

Time (s): cpu = 00:00:54 ; elapsed = 00:00:46 . Memory (MB): peak = 2382.008 ; gain = 169.926

Phase 8 Verifying routed nets

 Verification completed successfully
Phase 8 Verifying routed nets | Checksum: 21ea4510e

Time (s): cpu = 00:00:54 ; elapsed = 00:00:46 . Memory (MB): peak = 2382.008 ; gain = 169.926

Phase 9 Depositing Routes
Phase 9 Depositing Routes | Checksum: 26955a916

Time (s): cpu = 00:00:55 ; elapsed = 00:00:46 . Memory (MB): peak = 2382.008 ; gain = 169.926

Phase 10 Post Router Timing
INFO: [Route 35-57] Estimated Timing Summary | WNS=7.963  | TNS=0.000  | WHS=0.077  | THS=0.000  |

INFO: [Route 35-327] The final timing numbers are based on the router estimated timing analysis. For a complete and accurate timing signoff, please run report_timing_summary.
Phase 10 Post Router Timing | Checksum: 26955a916

Time (s): cpu = 00:00:55 ; elapsed = 00:00:46 . Memory (MB): peak = 2382.008 ; gain = 169.926
INFO: [Route 35-16] Router Completed Successfully

Phase 11 Post-Route Event Processing
Phase 11 Post-Route Event Processing | Checksum: 117f984e9

Time (s): cpu = 00:00:55 ; elapsed = 00:00:46 . Memory (MB): peak = 2382.008 ; gain = 169.926
Ending Routing Task | Checksum: 117f984e9

Time (s): cpu = 00:00:55 ; elapsed = 00:00:46 . Memory (MB): peak = 2382.008 ; gain = 169.926

Routing Is Done.
INFO: [Common 17-83] Releasing license: Implementation
97 Infos, 48 Warnings, 0 Critical Warnings and 0 Errors encountered.
route_design completed successfully
route_design: Time (s): cpu = 00:00:58 ; elapsed = 00:00:48 . Memory (MB): peak = 2382.008 ; gain = 169.926
INFO: [runtcl-4] Executing : report_drc -file design_1_wrapper_drc_routed.rpt -pb design_1_wrapper_drc_routed.pb -rpx design_1_wrapper_drc_routed.rpx
Command: report_drc -file design_1_wrapper_drc_routed.rpt -pb design_1_wrapper_drc_routed.pb -rpx design_1_wrapper_drc_routed.rpx
INFO: [IP_Flow 19-1839] IP Catalog is up to date.
INFO: [DRC 23-27] Running DRC with 2 threads
INFO: [Vivado_Tcl 2-168] The results of DRC are in file D:/LVTN/lc3_24/lc3_24.runs/impl_1/design_1_wrapper_drc_routed.rpt.
report_drc completed successfully
INFO: [runtcl-4] Executing : report_methodology -file design_1_wrapper_methodology_drc_routed.rpt -pb design_1_wrapper_methodology_drc_routed.pb -rpx design_1_wrapper_methodology_drc_routed.rpx
Command: report_methodology -file design_1_wrapper_methodology_drc_routed.rpt -pb design_1_wrapper_methodology_drc_routed.pb -rpx design_1_wrapper_methodology_drc_routed.rpx
INFO: [Timing 38-35] Done setting XDC timing constraints.
INFO: [DRC 23-133] Running Methodology with 2 threads
INFO: [Vivado_Tcl 2-1520] The results of Report Methodology are in file D:/LVTN/lc3_24/lc3_24.runs/impl_1/design_1_wrapper_methodology_drc_routed.rpt.
report_methodology completed successfully
INFO: [runtcl-4] Executing : report_power -file design_1_wrapper_power_routed.rpt -pb design_1_wrapper_power_summary_routed.pb -rpx design_1_wrapper_power_routed.rpx
Command: report_power -file design_1_wrapper_power_routed.rpt -pb design_1_wrapper_power_summary_routed.pb -rpx design_1_wrapper_power_routed.rpx
INFO: [Timing 38-35] Done setting XDC timing constraints.
Running Vector-less Activity Propagation...

Finished Running Vector-less Activity Propagation
107 Infos, 48 Warnings, 0 Critical Warnings and 0 Errors encountered.
report_power completed successfully
INFO: [runtcl-4] Executing : report_route_status -file design_1_wrapper_route_status.rpt -pb design_1_wrapper_route_status.pb
INFO: [runtcl-4] Executing : report_timing_summary -max_paths 10 -report_unconstrained -file design_1_wrapper_timing_summary_routed.rpt -pb design_1_wrapper_timing_summary_routed.pb -rpx design_1_wrapper_timing_summary_routed.rpx -warn_on_violation 
INFO: [Timing 38-91] UpdateTimingParams: Speed grade: -1, Delay Type: min_max.
INFO: [Timing 38-191] Multithreading enabled for timing update using a maximum of 2 CPUs
INFO: [runtcl-4] Executing : report_incremental_reuse -file design_1_wrapper_incremental_reuse_routed.rpt
INFO: [Vivado_Tcl 4-1062] Incremental flow is disabled. No incremental reuse Info to report.
INFO: [runtcl-4] Executing : report_clock_utilization -file design_1_wrapper_clock_utilization_routed.rpt
INFO: [runtcl-4] Executing : report_bus_skew -warn_on_violation -file design_1_wrapper_bus_skew_routed.rpt -pb design_1_wrapper_bus_skew_routed.pb -rpx design_1_wrapper_bus_skew_routed.rpx
INFO: [Timing 38-91] UpdateTimingParams: Speed grade: -1, Delay Type: min_max.
INFO: [Timing 38-191] Multithreading enabled for timing update using a maximum of 2 CPUs
INFO: [Timing 38-480] Writing timing data to binary archive.
Write ShapeDB Complete: Time (s): cpu = 00:00:01 ; elapsed = 00:00:00.029 . Memory (MB): peak = 2382.008 ; gain = 0.000
Wrote PlaceDB: Time (s): cpu = 00:00:01 ; elapsed = 00:00:00.321 . Memory (MB): peak = 2382.008 ; gain = 0.000
Wrote PulsedLatchDB: Time (s): cpu = 00:00:00 ; elapsed = 00:00:00 . Memory (MB): peak = 2382.008 ; gain = 0.000
Writing XDEF routing.
Writing XDEF routing logical nets.
Writing XDEF routing special nets.
Wrote RouteStorage: Time (s): cpu = 00:00:01 ; elapsed = 00:00:00.129 . Memory (MB): peak = 2382.008 ; gain = 0.000
Wrote Netlist Cache: Time (s): cpu = 00:00:00 ; elapsed = 00:00:00.008 . Memory (MB): peak = 2382.008 ; gain = 0.000
Wrote Device Cache: Time (s): cpu = 00:00:00 ; elapsed = 00:00:00.013 . Memory (MB): peak = 2382.008 ; gain = 0.000
Write Physdb Complete: Time (s): cpu = 00:00:02 ; elapsed = 00:00:00.487 . Memory (MB): peak = 2382.008 ; gain = 0.000
INFO: [Common 17-1381] The checkpoint 'D:/LVTN/lc3_24/lc3_24.runs/impl_1/design_1_wrapper_routed.dcp' has been generated.
INFO: [Common 17-206] Exiting Vivado at Sat Apr 19 08:30:05 2025...

*** Running vivado
    with args -log design_1_wrapper.vdi -applog -m64 -product Vivado -messageDb vivado.pb -mode batch -source design_1_wrapper.tcl -notrace



****** Vivado v2023.2 (64-bit)
  **** SW Build 4029153 on Fri Oct 13 20:14:34 MDT 2023
  **** IP Build 4028589 on Sat Oct 14 00:45:43 MDT 2023
  **** SharedData Build 4025554 on Tue Oct 10 17:18:54 MDT 2023
    ** Copyright 1986-2022 Xilinx, Inc. All Rights Reserved.
    ** Copyright 2022-2023 Advanced Micro Devices, Inc. All Rights Reserved.

source design_1_wrapper.tcl -notrace
Command: open_checkpoint design_1_wrapper_routed.dcp
INFO: [Device 21-403] Loading part xc7z020clg400-1
Netlist sorting complete. Time (s): cpu = 00:00:00 ; elapsed = 00:00:00.029 . Memory (MB): peak = 1009.531 ; gain = 0.000
INFO: [Netlist 29-17] Analyzing 105 Unisim elements for replacement
INFO: [Netlist 29-28] Unisim Transformation completed in 0 CPU seconds
INFO: [Project 1-479] Netlist was created with Vivado 2023.2
INFO: [Project 1-570] Preparing netlist for logic optimization
Read ShapeDB Complete: Time (s): cpu = 00:00:00 ; elapsed = 00:00:00.010 . Memory (MB): peak = 1114.242 ; gain = 0.926
INFO: [Timing 38-478] Restoring timing data from binary archive.
INFO: [Timing 38-479] Binary timing data restore complete.
INFO: [Project 1-856] Restoring constraints from binary archive.
INFO: [Project 1-853] Binary constraint restore complete.
INFO: [Designutils 20-5722] Start Reading Physical Databases.
Reading placement.
Read Netlist Cache: Time (s): cpu = 00:00:00 ; elapsed = 00:00:00.003 . Memory (MB): peak = 1718.145 ; gain = 0.000
Reading placer database...
Read Device Cache: Time (s): cpu = 00:00:00 ; elapsed = 00:00:00.012 . Memory (MB): peak = 1718.145 ; gain = 0.000
Read PlaceDB: Time (s): cpu = 00:00:00 ; elapsed = 00:00:00.122 . Memory (MB): peak = 1718.145 ; gain = 0.000
Read PulsedLatchDB: Time (s): cpu = 00:00:00 ; elapsed = 00:00:00 . Memory (MB): peak = 1718.145 ; gain = 0.000
Reading routing.
Read RouteStorage: Time (s): cpu = 00:00:01 ; elapsed = 00:00:00.047 . Memory (MB): peak = 1718.145 ; gain = 0.000
Read Physdb Files: Time (s): cpu = 00:00:01 ; elapsed = 00:00:00.192 . Memory (MB): peak = 1718.145 ; gain = 0.000
Restored from archive | CPU: 1.000000 secs | Memory: 0.000000 MB |
Finished XDEF File Restore: Time (s): cpu = 00:00:01 ; elapsed = 00:00:00.230 . Memory (MB): peak = 1718.145 ; gain = 8.012
Netlist sorting complete. Time (s): cpu = 00:00:00 ; elapsed = 00:00:00.001 . Memory (MB): peak = 1718.145 ; gain = 0.000
INFO: [Project 1-111] Unisim Transformation Summary:
No Unisim elements were transformed.

The system cannot find the path specified.
INFO: [Project 1-604] Checkpoint was created with Vivado v2023.2 (64-bit) build 4029153
open_checkpoint: Time (s): cpu = 00:00:15 ; elapsed = 00:00:15 . Memory (MB): peak = 1718.145 ; gain = 1315.789
Command: write_bitstream -force design_1_wrapper.bit
Attempting to get a license for feature 'Implementation' and/or device 'xc7z020'
INFO: [Common 17-349] Got license for feature 'Implementation' and/or device 'xc7z020'
Running DRC as a precondition to command write_bitstream
INFO: [IP_Flow 19-234] Refreshing IP repositories
INFO: [IP_Flow 19-1704] No user IP repositories specified
INFO: [IP_Flow 19-2313] Loaded Vivado IP repository 'F:/Vivado/2023.2/data/ip'.
INFO: [DRC 23-27] Running DRC with 2 threads
INFO: [Vivado 12-3199] DRC finished with 0 Errors
INFO: [Vivado 12-3200] Please refer to the DRC report (report_drc) for more information.
INFO: [Designutils 20-2272] Running write_bitstream with 2 threads.
Loading data files...
Loading site data...
Loading route data...
Processing options...
Creating bitmap...
Creating bitstream...
Writing bitstream ./design_1_wrapper.bit...
INFO: [Vivado 12-1842] Bitgen Completed Successfully.
INFO: [Project 1-1876] WebTalk data collection is mandatory when using a ULT device. To see the specific WebTalk data collected for your design, open the usage_statistics_webtalk.html or usage_statistics_webtalk.xml file in the implementation directory.
INFO: [Common 17-83] Releasing license: Implementation
23 Infos, 0 Warnings, 0 Critical Warnings and 0 Errors encountered.
write_bitstream completed successfully
write_bitstream: Time (s): cpu = 00:00:11 ; elapsed = 00:00:10 . Memory (MB): peak = 2242.113 ; gain = 523.969
INFO: [Common 17-206] Exiting Vivado at Sat Apr 19 08:30:56 2025...
